{
  "topic": "how to choose a home arcade machine",
  "working_title": "How to Choose a Home Arcade Machine Worth Keeping",
  "primary_keyword": "how to choose a home arcade machine",
  "search_intent": "informational",
  "funnel_stage": "",
  "product_fit": "high",
  "draft_markdown": "# How to Choose a Home Arcade Machine Worth Keeping\n\nThere is something about the idea of having an arcade machine at home that just makes sense at a certain point in life. The kids are grown or nearly there, the house has a bar area or a basement lounge that could use a focal point, and the memory of dropping quarters into a glowing screen on a Friday night still carries real warmth. More and more homeowners are discovering that a home arcade is not a novelty impulse - it is a genuine addition to a leisure space, one that earns its place the same way a good pool table or a well-stocked bar cart does.\n\nBut choosing the right machine is not as straightforward as it looks. The market ranges from massive full-size cabinets to compact countertop units, from machines loaded with thousands of questionable titles to carefully curated libraries of games you will actually enjoy. Some require Wi-Fi, software updates, and a willingness to troubleshoot. Others plug in and play from the moment they arrive.\n\nThis guide is written for homeowners - not hobbyists, not collectors, not people who enjoy the project of building something from parts. If you care about how a machine looks in your home, how easy it is to live with day to day, and whether it will still feel like a good decision a year from now, you are in the right place. The goal here is ownership confidence: helping you understand what matters, what does not, and how to make a choice you will not regret.\n\n## Why home arcades are making a comeback in adult homes\n\nFor a long time, home arcades were associated with dedicated collectors - people who tracked down original machines, restored them by hand, and built basements around them. That world still exists, but something broader has shifted. A growing number of homeowners are adding arcade machines to finished spaces not because they are collectors, but because the experience fits a real gap in how they spend time at home.\n\nPart of it is nostalgia, and there is no reason to be shy about that. If you grew up in the late seventies, eighties, or early nineties, the arcade was a social place. The games were simple enough to pick up but satisfying enough to stay with. That feeling - standing shoulder to shoulder with someone, focused on a shared screen - does not have a modern equivalent in most homes. A home arcade brings it back without requiring anyone to learn new technology or commit to a two-hour session.\n\nBut nostalgia alone does not explain why these machines are finding their way into home bars and basement lounges. The practical reality is that a well-chosen arcade machine is a genuinely good hosting piece. When friends come over, it gives the room energy and a natural activity. It draws people in without demanding attention. It works for couples, for multigenerational gatherings, for a quiet weeknight at home. That versatility - social when you want it, low-key when you do not - is what makes a home arcade feel like a lasting addition rather than a passing novelty.\n\n## Full-size cabinet vs. bartop vs. countertop - understanding the formats\n\nThe first real decision when choosing a home arcade is format, and it matters more than most buying guides suggest. The machine's size and shape determine not just where it can go, but how it lives in your home over time - whether it enhances a room or overwhelms it.\n\n**Full-size cabinets** are the ones most people picture first: standing units, often four to five feet tall, with a dedicated screen, controls, and a built-in stand. They make a strong visual statement and can be wonderful in the right setting - a large, dedicated game room with enough floor space that the cabinet does not crowd the area. The tradeoff is that they are substantial pieces. They take up real floor space, they are difficult to move once placed, and in many homes they end up looking like they belong in a commercial venue rather than a private living area. If your space is a finished basement with room to spare, a full-size cabinet can work well. If your space is a home bar, an open-plan lounge, or a room that serves multiple purposes, the footprint becomes a genuine issue.\n\n**Bartop and countertop machines** take a different approach. These are compact units designed to sit on an existing surface - a bar counter, a side table, a dedicated shelf. They occupy the same kind of space as a high-end coffee machine or a turntable, fitting into a room rather than dominating it. For homeowners who want arcade play without rearranging their living space, this format often makes the most practical sense. The [JVL Echo Home](/en/echo), for example, is a premium bartop arcade designed specifically for home environments like bars and basement lounges - the kind of machine that sits comfortably on a counter and looks like it belongs there.\n\nThe right format depends on your space and your priorities. A full-size cabinet offers presence and a classic silhouette. A bartop or countertop machine offers flexibility, a smaller footprint, and - in many homes - a better fit alongside real furniture. Neither is inherently better. But for most homeowners adding an arcade to an existing room, the compact formats tend to age better in the space.\n\n## What to look for in build quality and finish\n\nThis is where many buying guides fall short. They will mention that a machine \"feels sturdy\" or list a spec like \"MDF construction,\" and move on. But for a homeowner placing something in a finished room, build quality is really about two things: how the machine looks next to your other furniture, and whether it will still look that way in two or three years.\n\nStart with the exterior finish. A home arcade machine is going to sit in a visible spot - on your bar, in your lounge, in a room where you host people. It should look intentional, not like a piece of equipment you are tolerating. Ask whether the materials and finish feel considered. Does it have the kind of surface quality you would expect from a piece of home furniture? Or does it look and feel like something designed for a commercial floor where appearance is secondary to function?\n\nControls and the playing surface matter too, but again, think in ownership terms rather than spec terms. Are the buttons and screen going to hold up to regular use over years, not just months? Is the build solid enough that it does not wobble on a countertop or feel fragile when two people are playing side by side?\n\nThe honest truth is that build quality varies enormously across the home arcade market. Some machines at lower price points deliver surprising quality. Others that look impressive in product photos reveal thin materials, loose joints, and cheap finishes once they arrive. The safest approach is to look for manufacturers who design specifically for home environments and who treat the machine as a piece of home leisure - not a gadget or a toy. A machine built with that mindset tends to age well in a room because it was designed to live there from the start.\n\n## Game library - built-in games vs. downloads and online dependencies\n\nOne of the most common selling points in the home arcade market is game count. You will see machines advertised with 500, 1,200, even 5,000 or more built-in titles. The numbers sound impressive, but they deserve a closer look before they influence your decision.\n\nThe reality with very large game libraries is that most of those titles are filler. Many are obscure games that no one recognises, regional variants of the same title, or games so dated that even nostalgia cannot make them enjoyable. After the initial novelty of scrolling through a massive list, most owners settle into a rotation of perhaps a few dozen games they actually enjoy. The rest sit untouched.\n\nA more useful way to think about game libraries is to ask whether the games that come with the machine are ones you will genuinely want to play. A curated collection of familiar, well-chosen titles - the kind of classics you actually remember from the arcade - is worth more in practice than thousands of games that pad a spec sheet. The JVL Echo Home takes this approach with 149 built-in games, offering a ready-to-play library without the clutter of filler titles.\n\nThere is another dimension here that matters more than most people expect: online dependencies. Some machines require a Wi-Fi connection to access their full game library, download updates, or activate features. That might sound minor, but it introduces friction. Wi-Fi in a basement lounge is not always reliable. Software updates can change the interface or introduce issues. And if the company behind the machine stops supporting its servers, your game library could shrink or disappear.\n\nMachines that work entirely offline - everything built in, no downloads needed, no Wi-Fi required - avoid all of these concerns. They work the same way on day one as they will three years from now. For a homeowner who wants reliability and simplicity, that independence is a genuine advantage.\n\n## Ease of setup and daily use - plug-and-play vs. project machines\n\n\"Plug and play\" is a phrase that gets used loosely in this market, so it is worth being specific about what it actually means - and what it does not.\n\nA genuinely plug-and-play machine arrives ready to use. You take it out of the box, place it where you want it, plug it in, and start playing. No assembly beyond the basics, no software to configure, no account to create, no firmware to update. That simplicity is not a limitation - it is a design choice that prioritises the owner's experience over the manufacturer's ability to push updates or sell additional content.\n\nOn